{
  "mithridatium_version": "0.1.1",
  "timestamp_utc": "2025-12-03T03:08:00.671606Z",
  "model_path": "models/resnet18_poison.pth",
  "defense": "strip",
  "dataset": "cifar10",
  "results": {
    "entropies": [
      1.1235064268112183,
      1.1577751636505127,
      1.0046749114990234,
      0.6645984053611755,
      0.8966189622879028,
      0.7726051211357117,
      1.1305280923843384,
      1.0512144565582275,
      1.1708745956420898,
      0.9146627187728882,
      0.31983980536460876,
      0.9245892763137817,
      0.9730837941169739,
      1.414028525352478,
      0.93205726146698,
      0.6323205828666687,
      1.0372687578201294,
      0.8825169801712036,
      0.8024986982345581,
      0.9925529360771179,
      1.3223257064819336,
      1.1212986707687378,
      0.7831767797470093,
      1.191709041595459,
      1.0734102725982666,
      1.2206270694732666,
      1.1773344278335571,
      1.29635488986969,
      0.9654883146286011,
      0.9064605832099915,
      1.354981541633606,
      0.6870617866516113
    ],
    "num_bases": 32,
    "num_perturbations": 16
  }
}