{
  "mithridatium_version": "0.1.1",
  "timestamp_utc": "2026-04-01T02:54:15.492273Z",
  "model_path": "microsoft/resnet-50",
  "defense": "mmbd",
  "dataset": "cifar10_for_imagenet",
  "results": {
    "defense": "mmbd",
    "per_class_scores": [
      53.0788688659668,
      49.00693893432617,
      51.85292434692383,
      30.347305297851562,
      59.851112365722656
    ],
    "normalized_scores": [
      0.2905450634930737,
      0.6744897501960817,
      0.0,
      5.096765273642497,
      1.8955458502849243
    ],
    "p_value": 0.3248688254900287,
    "verdict": "Likely clean",
    "thresholds": {
      "p_value": 0.05,
      "normalized_score": {
        "normal": [
          0.0,
          1.5
        ],
        "mild": [
          1.5,
          3.0
        ],
        "suspicious": [
          3.0,
          5.0
        ],
        "very_suspicious": [
          5.0,
          null
        ]
      }
    },
    "parameters": {
      "NC": 1000,
      "NSTEP": 75,
      "optimizer": "SGD(momentum=0.2)",
      "lr_init": 0.01,
      "device": "cpu"
    },
    "dataset": "cifar10_for_imagenet",
    "top_eigenvalue": 59.851112365722656
  }
}